{
  "$schema": "https://json-schema.org/draft/2020-12/schema",
  "$id": "./grc721.schema.json",
  "title": "GRC721 collection list",
  "type": "array",
  "items": {
    "type": "object",
    "additionalProperties": false,
    "required": [
      "name",
      "pkg_path",
      "symbol",
      "chain_id",
      "description",
      "website_url",
      "twitter_url",
      "discord_url",
      "docs_url",
      "image"
    ],
    "properties": {
      "name": {
        "type": "string",
        "minLength": 1
      },
      "pkg_path": {
        "type": "string",
        "pattern": "^gno\\.land/.+"
      },
      "symbol": {
        "type": "string",
        "minLength": 1
      },
      "chain_id": {
        "type": "string",
        "minLength": 1
      },
      "description": {
        "type": "string",
        "minLength": 1,
        "maxLength": 1500
      },
      "website_url": {
        "type": "string",
        "anyOf": [
          {
            "const": ""
          },
          {
            "format": "uri"
          }
        ]
      },
      "twitter_url": {
        "type": "string",
        "anyOf": [
          {
            "const": ""
          },
          {
            "format": "uri"
          }
        ]
      },
      "discord_url": {
        "type": "string",
        "anyOf": [
          {
            "const": ""
          },
          {
            "format": "uri"
          }
        ]
      },
      "docs_url": {
        "type": "string",
        "anyOf": [
          {
            "const": ""
          },
          {
            "format": "uri"
          }
        ]
      },
      "image": {
        "type": "string",
        "anyOf": [
          {
            "const": ""
          },
          {
            "pattern": "^/grc721/images/[^/]+\\.svg$"
          }
        ]
      }
    }
  }
}
