[
  {
    "name": "GNOSWAP NFT",
    "pkg_path": "gno.land/r/gnoswap/gnft",
    "symbol": "GNFT",
    "chain_id": "staging",
    "description": "GNFT is the GnoSwap liquidity position NFT. Each token represents a concentrated liquidity position minted when a liquidity provider adds liquidity to a GnoSwap pool.",
    "website_url": "https://gnoswap.io",
    "twitter_url": "https://x.com/gnoswaplabs",
    "discord_url": "https://discord.com/invite/u4bdGHStb2",
    "docs_url": "https://docs.gnoswap.io",
    "image": "/grc721/images/gno_land_r_gnoswap_gnft.svg"
  }
]
